<?xml version="1.0" encoding="UTF-8" ?>
<!DOCTYPE bambus SYSTEM "../../Resource/DTD/application_v1.dtd">
<bambus>
	<appController guid="org.bambuscms.applications.systeminformation">ASystemInformation</appController>
	<name>system_information</name>
	<description>view_stats</description>
	<icon>app-system-status</icon>
	<version>0.10.20061011</version>
	<priority>1.9</priority>
	<purpose>system</purpose>
	<tabs>
		<tab icon="action-inform">system_information</tab>
	</tabs>
	<application>
		<controller>controller.php</controller>
		<interface name="system_information" src="info.php">
			<panel name="server_actions">
            	<task type="button" hotkey="R" caption="repair" icon="action-system-repair" action="repair_rights" mode="html" />
            	<task type="button" hotkey="C" caption="clear_cache" icon="action-clean" action="_clear_cache" mode="html" />
            </panel>
		</interface>
	</application>
</bambus>