<?xml version="1.0" encoding="UTF-8" ?>
<!DOCTYPE bambus SYSTEM "../../Resource/DTD/application_v1.dtd">
<bambus>
	<appController guid="org.bambuscms.applications.textbricks">ATextBricks</appController>
	<name>text_bricks</name>
	<description>edit_text_bricks</description>
	<icon>app-text-bricks</icon>
	<version>0.1.20090310</version>
	<priority>2.0</priority>
	<purpose>manage_content</purpose>
	<tabs>
		<tab icon="action-edit">edit</tab>
	</tabs>
	<application>
		<controller>controller.php</controller>
		<interface name="edit" src="edit.php">
			<task type="button" hotkey="o" caption="open" icon="action-document-open" action="org.bambuscms.wopenfiledialog.toggle();" />
			<task type="button" hotkey="s" caption="save" icon="action-document-save" action="org.bambuscms.app.document.save()" />
			<task type="button" hotkey="S" caption="save_and_rename" icon="action-document-save-as" action="org.bambuscms.app.document.saveAs('filename')" />
			<task type="button" hotkey="N" caption="new" icon="action-document-new" action="Create()" />
			<task type="button" hotkey="X" caption="delete" icon="action-edit-delete" action="Delete()" />
			<task type="spacer" />
			<task type="button" hotkey="C" caption="cleanup" icon="action-edit-clean" action="org.bambuscms.app.document.cleanHTML('')" />
			<task type="button" hotkey="R" caption="search_and_replace" icon="action-edit-find-replace" action="org.bambuscms.app.document.searchAndReplace()" />
		</interface>
	</application>
</bambus>