<?xml version="1.0" encoding="UTF-8" ?>
<!DOCTYPE bambus SYSTEM "../../Resource/DTD/application_v1.dtd">
<bambus>
	<appController guid="org.bambuscms.applications.configuration">AConfiguration</appController>
	<name>configuration</name>
	<description>edit_configuration</description>
	<icon>app-preferences-enviornment</icon>
	<version>0.10.20061011</version>
	<priority>1.9</priority>
	<purpose>system</purpose>
	<tabs>
		<tab icon="action-edit">edit</tab>
	</tabs>
	<application>
		<controller>controller.php</controller>
		<interface name="edit" src="edit.php">
			<task type="button" hotkey="s" caption="save"
				icon="action-document-save" action="org.bambuscms.app.document.save()" />
		</interface>
	</application>
</bambus>